{"event_log_digest":"9518f58250af92fe8584e564759fe49223fc6da946491d4a6dbc831c717e206f","event_log_first_events":[{"actor_id":"a0","actor_role":"endogenous_agent","cause_id":null,"event_id":1,"event_type":"order_submit","ext":{"min_lob_a.mid_reference":1000},"l1":{"ask_price":null,"ask_size":null,"bid_price":997,"bid_size":3},"order_id":"order-0","price":997,"quantity":3,"seq":0,"side":"buy","t":1,"trade_id":null},{"actor_id":"a1","actor_role":"endogenous_agent","cause_id":null,"event_id":2,"event_type":"order_submit","ext":{"min_lob_a.mid_reference":998},"l1":{"ask_price":null,"ask_size":null,"bid_price":997,"bid_size":3},"order_id":"order-1","price":996,"quantity":1,"seq":1,"side":"buy","t":1,"trade_id":null},{"actor_id":"a2","actor_role":"endogenous_agent","cause_id":null,"event_id":3,"event_type":"order_submit","ext":{"min_lob_a.mid_reference":998},"l1":{"ask_price":null,"ask_size":null,"bid_price":997,"bid_size":6},"order_id":"order-2","price":997,"quantity":3,"seq":2,"side":"buy","t":1,"trade_id":null}],"event_log_header":{"engine":{"engine_id":"min-lob-a","engine_version":"2.0.0"},"instruments":["CANARY"],"l1_availability":"inline","log_id":"min-lob-a-20260821","ordering":{"causality":"complete","t_unique_monotonic":false,"total_order_key":"event_id"},"price_unit":{"kind":"tick","tick_size":1},"quantity_unit":{"kind":"lot","lot_size":1},"schema_version":"1.1.0","time_origin":"t=1 is the first agent round; t=n_steps+1 carries the terminal book snapshot only","time_unit":"step"},"event_log_ref":"fixtures/canary/exact-lob-min (min-lob-a, regenerated by run_canary.py)","parameters":{"depth":{"definition":"mean over the window of (bid_size + ask_size) / 2 at Level-I","level":1},"interval":{"kind":"fixed_event_count","note":"an interval is a fixed number of consecutive events; 'fixed_step_count' is the other permitted kind and means a fixed number of engine steps","size":4},"sampling":{"depth_series":"every event carrying Level-I","note":"sampling is event-driven, not clock-driven; a clock-driven rule would need an interpolation rule that this contract does not define","spread_series":"every event carrying Level-I"},"shock":{"injection_time":20,"profile_events":12,"protocol":"market_order","side":"buy","size":5,"time_unit":"step"},"window":{"intervals":20,"note":"a window is a fixed number of consecutive intervals; one OLS fit is produced per window"}},"schema_version":"1.0.0"}
